{
  "schema_version": "1.0",
  "source": "colonist.io screenshot (example)",
  "layout": {
    "orientation": "pointy",
    "radius": 2
  },
  "hexes": [
    {"id": 0, "q": 0, "r": -2, "s": 2, "terrain": "mountains", "resource": "ore", "number": 10},
    {"id": 1, "q": 1, "r": -2, "s": 1, "terrain": "pasture", "resource": "sheep", "number": 2},
    {"id": 2, "q": 2, "r": -2, "s": 0, "terrain": "forest", "resource": "wood", "number": 9},
    {"id": 3, "q": -1, "r": -1, "s": 2, "terrain": "fields", "resource": "wheat", "number": 12},
    {"id": 4, "q": 0, "r": -1, "s": 1, "terrain": "hills", "resource": "brick", "number": 6},
    {"id": 5, "q": 1, "r": -1, "s": 0, "terrain": "pasture", "resource": "sheep", "number": 4},
    {"id": 6, "q": 2, "r": -1, "s": -1, "terrain": "hills", "resource": "brick", "number": 10},
    {"id": 7, "q": -2, "r": 0, "s": 2, "terrain": "fields", "resource": "wheat", "number": 9},
    {"id": 8, "q": -1, "r": 0, "s": 1, "terrain": "forest", "resource": "wood", "number": 11},
    {"id": 9, "q": 0, "r": 0, "s": 0, "terrain": "desert", "resource": null, "number": null},
    {"id": 10, "q": 1, "r": 0, "s": -1, "terrain": "forest", "resource": "wood", "number": 3},
    {"id": 11, "q": 2, "r": 0, "s": -2, "terrain": "mountains", "resource": "ore", "number": 8},
    {"id": 12, "q": -2, "r": 1, "s": 1, "terrain": "forest", "resource": "wood", "number": 8},
    {"id": 13, "q": -1, "r": 1, "s": 0, "terrain": "mountains", "resource": "ore", "number": 3},
    {"id": 14, "q": 0, "r": 1, "s": -1, "terrain": "fields", "resource": "wheat", "number": 4},
    {"id": 15, "q": 1, "r": 1, "s": -2, "terrain": "pasture", "resource": "sheep", "number": 5},
    {"id": 16, "q": -2, "r": 2, "s": 0, "terrain": "hills", "resource": "brick", "number": 5},
    {"id": 17, "q": -1, "r": 2, "s": -1, "terrain": "fields", "resource": "wheat", "number": 6},
    {"id": 18, "q": 0, "r": 2, "s": -2, "terrain": "pasture", "resource": "sheep", "number": 11}
  ],
  "ports": [
    {"type": "3:1", "nodes": [1, 5]},
    {"type": "wheat", "nodes": [6, 10]},
    {"type": "ore", "nodes": [20, 26]},
    {"type": "3:1", "nodes": [42, 46]},
    {"type": "sheep", "nodes": [49, 53]},
    {"type": "3:1", "nodes": [48, 51]},
    {"type": "3:1", "nodes": [33, 38]},
    {"type": "brick", "nodes": [16, 21]},
    {"type": "wood", "nodes": [3, 7]}
  ],
  "robber_hex": 9,
  "turn_order": [
    "red",
    "blue",
    "orange",
    "white"
  ],
  "current_player": "red",
  "turn_number": 1,
  "perspective": "red",
  "starting_resources": "second_settlement",
  "players": [
    {
      "color": "red",
      "settlements": [31, 20],
      "cities": [],
      "roads": [37, 32]
    },
    {
      "color": "blue",
      "settlements": [39, 28],
      "cities": [],
      "roads": [56, 34]
    },
    {
      "color": "orange",
      "settlements": [14, 40],
      "cities": [],
      "roads": [15, 58]
    },
    {
      "color": "white",
      "settlements": [48, 8],
      "cities": [],
      "roads": [63, 12]
    }
  ],
  "meta": {
    "confidence": {
      "terrain": 0.97,
      "numbers": 0.95
    },
    "warnings": []
  }
}
